映画名,ジャンル,評価,年代,監督名,俳優名
チャーチル/ヒトラーから世界,戦争,4.3,2017,ジョー・ライト,"ゲイリー・オールドマン, リリー・ジェームズ"
アイヒマンを追え!,史実,4.1,2015,ラース・クラウメ,"ブルクハルト・クラウスナー, ロナルト・ツェアフェルト"
オーシャンズ11,クライム,4.3,2001,スティーブン・ソダーバーグ,"ジョージ・クルーニー, ジュリア・ロバーツ"
オーシャンズ12,クライム,4.3,2004,スティーブン・ソダーバーグ,"ジョージ・クルーニー, ジュリア・ロバーツ"
オーシャンズ13,クライム,4.3,2007,スティーブン・ソダーバーグ,"ジョージ・クルーニー, ジュリア・ロバーツ"
オーシャンズ8,アクション,3.9,2018,ゲイリー・ロス,"サンドラ・ブロック, ケイト・ブランシェット"
ホビット/思いがけない冒険,ファンタジー,4.5,2012,ピーター・ジャクソン,"マーティン・フリーマン, イライジャ・ウッド"
ホビット/竜に奪われた王国,ファンタジー,4.5,2013,ピーター・ジャクソン,"マーティン・フリーマン, イライジャ・ウッド"
ホビット/決戦のゆくえ,ファンタジー,4.5,2014,ピーター・ジャクソン,"マーティン・フリーマン, リチャード・アーミティッジ"
トレインスポッティング,クライム,4.4,1996,ダニー・ボイル,"ユアン・マクレガー, ジョニー・リー・ミラー"
T2トレインスポッティング,クライム,3.9,2017,ダニー・ボイル,"ユアン・マクレガー, ジョニー・リー・ミラー"
ファンタビ/魔法使いの旅,ファンタジー,4.4,2016,デヴィッド・イェーツ,"エディ・レッドメイン, キャサリン・ウォーターストン"
ファンタビ/黒い魔法使いの誕生,ファンタジー,4.4,2018,デヴィッド・イェーツ,"エディ・レッドメイン, ジョニー・デップ"
きっと、うまくいく,コメディ,4.5,2009,ラージクマール・ヒラニ,"アーミル・カール, シャルマン・ジョーシー"
ゾディアック,スリラー,4.6,2007,デヴィッド・フィンチャー,"ジェイク・ギレンホール, ロバート・ダウニー・Jr"
黙秘,スリラー,4.6,1995,テイラー・ハックフォード,"キャシー・ベイツ, ジェニファー・ジェイソン・リー"
ノクターナル・アニマルズ,スリラー,4.5,2016,トム・フォード,"ジェイク・ギレンホール, マイケル・シャノン"
ハングマン,スリラー,4.5,2017,ジョニー・マーティン,"アル・パチーノ, カール・アーバン"
ボヘミアン・ラプソディ,ミュージカル,4.4,2018,ブライアン・シンガー,"ラミ・マレック, ベン・ハーディ"
ザ・ウォール,戦争,4.0,2017,ダグ・リーマン,"アーロン・テイラージョンソン, ジョン・シナ"
コードネームアンクル,アクション,4.4,2015,ガイ・リッチー,"アーミー・ハマー, ヘンリー・カヴィル"
バッド・ジーニアス,スリラー,4.5,2017,ナタウット・プーンピリヤ,"Chutimon, Chanon"
コールドアンドファイヤー,戦争,3.9,2016,オーレ・ポールネダル,"ピルウ・アスベック, ニコラス・ブロ"
ベンジャミンバトン,ロマンス,4.5,2008,デヴィッド・フィンチャー,"ブラッド・ピット, ケイト・ブランシェット"
最高の人生の作り方,ロマンス,3.9,2014,ロブ・ライナー,"マイケル・ダグラス, ダイアン・キートン"
トゥルーマンショー,コメディ,4.3,1998,ピーター・ウィアー,"ジム・キャリー, ローラ・リニー"
大脱出,アクション,4.4,2013,ミカエル・ハフストローム,"シルヴェスター・スタローン, アーノルド・シュワルツェネッガー"
大脱走,戦争,4.6,1963,ジョン・スタージェス,"スティーブン・マックイーン, ジェームズ・ガーナー"
十二人の怒れる男,スリラー,4.7,1957,シドニー・ルメット,"ヘンリー・フォンダ, リー・J・コップ"
十二人の死にたい子どもたち,ミステリー,4.4,2019,堤幸彦,"吉川愛, 新田真剣佑"
ジョーカー,クライム,4.4,2019,ドット・フィリップス,"ホアキン・フェニックス, ロバート・デニーロ"
シャーロック・ホームズ,アクション,4.4,2009,ガイ・リッチー,"ロバート・ダウニー・Jr, ジュード・ロウ"
シャーロック・ホームズ/シャドウ〜,アクション,4.4,2011,ガイ・リッチー,"ロバート・ダウニー・Jr, ジュード・ロウ"
完全なるチェックメイト,ドラマ,4.4,2014,エドワード・ズウィック,"トビー・マグワイア, リーヴ・シュレイバー"
ジャンゴ,西部劇,4.6,2012,クエンティン・タランティーノ,"クリストフ・ヴァルツ, ジェイミー・フォックス"
マイインターン,ドラマ,4.3,2015,ナンシー・マイヤーズ,"ロバート・デニーロ, アン・ハサウェイ"
アバウトタイム,ロマンス,4.1,2013,リチャード・カーティス,"レイチェル・マクアダムス, ドーナル・グリーソン"
プラトーン,戦争,4.3,1986,オリバー・ストーン,"ウィレム・デフォー, トム・ベレンジャー"
ギフテッド,ドラマ,4.4,2017,マーク・ウェブ,"マッケンナ・グレイス, クリス・エヴァンス"
月に囚われた男,SF,4.2,2009,ダンカン・ジョーンズ,"サム・ロックウェル, ケヴィン・スペイシー"
チェ39歳別れの手紙,戦争,4.3,2008,スティーブン・ソダーバーグ,"ベニチオ・デル・トロ, デミアン・ビチル"
砂上の法廷,スリラー,4.2,2016,コートニー・ハント,"キアヌ・リーブス, レネー・ゼルウィガー"
パラサイト,スリラー,4.9,2019,ポン・ジュノ,"イ・ソンギュン, チョ・ヨジョン, ソン・ガンホ"
サイコ,ホラー,4.6,1960,アルフレッド・ヒッチコック,"アンソニー・パーキンス, ジャネット・リー"
ファーゴ,クライム,4.4,1996,ジョエル・コーエン,"フランシス・マクドーマンド, スティーヴ・ブシェミ"
ミスト,SF,4.5,2007,フランク・ダラボン,"トーマス・ジェーン, ローリー・ホールデン"
ブルーマインド,ファンタジー,4.1,2018,リサ・ブリュールマン,"ルナ・ウェドラー, ゾエ・パステル・ホルトゥイゼン"
私が生きる肌,ホラー,4.4,2011,ペドロ・アルモドバル,"アントニオ・バンデラス, エレナ・アナヤ"
ハウンター,SF,4.3,2013,ヴィンチェンゾ・ナタリ,"アビゲイル・ブレスリン, エレノア・ジッチ"
ディバイナー,戦争,4.2,2014,ラッセル・クロウ,"オルガ・キュリレンコ, ジェイ・コートニー"
グエムル,SF,4.4,2006,ポン・ジュノ,"ソン・ガンホ, パク・ヘイル"
ルーシー,SF,4.4,2014,リュック・ベッソン,"スカーレット・ヨハンソン, モーガン・フリーマン"
それでも夜は明ける,ドラマ,4.4,2013,スティーブ・マックイーン,"キウェテル・イジョフォー, マイケル・ファスベンダー"
母なる証明,スリラー,4.4,2009,ポン・ジュノ,"ウォンビン, キム・ヘジャ"
スクリーム,ホラー,4.2,1996,ウェス・クレイブン,"ネーヴ・キャンベル, コートニー・コックス"
フェイク,クライム,4.4,1997,マイク・ニューウェル,"アル・パチーノ, ジョニー・デップ"
マンデラの名もなき看守,ドラマ,4.1,2007,ビレ・アウグスト,"ジョセフ・ファインズ, デニス・ヘイスバート"
ライ麦畑の反逆児,ドラマ,4.0,2017,ダニー・ストロング,"ニコラス・ホルト, ケヴィン・スペイシー"
地中海殺人事件,ミステリー,4.0,1982,ガイ・ハミルトン,"ピーター・ユスティノフ, マギー・スミス"
ミッドナイト・イン・パリ,ロマンス,4.0,2011,ウディ・アレン,"オーウェン・ウィルソン, レイチェル・マクアダムス"
カサブランカ,ロマンス,4.0,1942,マイケル・カーティス,"ハンフリー・ボガート, イングリッド・バーグマン"
ロストストレイト,戦争,3.9,2018,バフラーム・タヴァコリー,"ジャヴァド・エザティ, アミールジャ・ディディ"
グリーンブック,ドラマ,4.1,2018,ピーター・ファレリー,"ヴィゴ・モーテンセン, マハーシャラ・アリ"
キャリー,ホラー,4.0,2013,キンバリー・ピアース,"クロエ・モレッツ, ジュリアン・ムーア"
ピエロがお前を嘲笑う,スリラー,4.0,2014,バラン・ボー・オダー,"トム・シリング, ヴォータン・ヴィルケ・メーリング"
殺人の追憶,スリラー,4.0,2003,ポン・ジュノ,"ソン・ガンホ, パク・へイル"
エスター,ホラー,4.3,2009,ジャウム・コレットセラ,"イザベル・ファーマン, ヴェラ・ファミーガ"
エスター/ファーストキル,ホラー,3.9,2022,ウィリアム・ブレント・ベル,"イザベル・ファーマン, ジュリア・スタイルズ"
キャストアウェイ,ドラマ,4.0,2000,ロバート・ゼメキス,"トム・ハンクス, ヘレン・ハント"
カリートの道,クライム,4.0,1993,ブライアン・デパルマ,"アル・パチーノ, ショーン・ベン"
痩せゆく男,ホラー,3.9,1996,トム・ホランド,"ロバート・ジョン・バーク, カリ・ウーラー"
アス,ホラー,4.3,2019,ジョーダン・ピール,"ウィンストン・デューク, ルピタ・ニョンゴ"
アバウト・シュミット,ドラマ,3.9,2002,アレクサンダー・ペイン,"ジャック・ニコルソン, キャシー・ベイツ"
イントゥ・ザ・ワイルド,ドラマ,3.9,2007,ショーン・ペン,"エミール・ハーシュ, クリステン・スチュワート"
デッドゾーン,ホラー,4.0,1983,デヴィッド・クローネンバーグ,"クリストファー・ウォーケン, マーティン・シーン"
ドリームハウス,ホラー,4.0,2011,ジム・シェリダン,"ダニエル・クレイグ, レイチェル・ワイズ"
アルキメデスの大戦,戦争,4.4,2019,山崎貴,"菅田将暉, 浜辺美波"
死霊館,ホラー,4.4,2013,ジェームズ・ワン,"ヴェラ・ファミーガ, パトリック・ウィルソン"
死霊館/エンフィールド事件,ホラー,4.4,2016,ジェームズ・ワン,"ヴェラ・ファミーガ, パトリック・ウィルソン"
アナベル/死霊館の人形,ホラー,4.0,ジョン・R・レオネッティ,"アナベル・ウォーリス, ウォード・ホートン"
アナベル/死霊人形の誕生,ホラー,4.0,デヴィッド・F・サンドバーグ,"タリサ・ペイトマン, ルールー・ウィルソン"
アナベル/死霊博物館,ホラー,4.0,ゲイリー・ドーベルマン,"マッケンナ・グレイス, パトリック・ウィルソン"
シークレットウィンドウ,ミステリー,4.0,2004,デヴィッド・コープ,"ジョニー・デップ, ジョン・タトゥーロ"
セルピコ,クライム,4.0,1973,シドニー・ルメット,"アル・パチーノ, コーネリア・シャープ"
ルーム,スリラー,4.3,2015,レニー・アブラハムソン,"ブリー・ラーソン, ジェイコブ・トレンブレイ"
シャッフル,スリラー,4.3,2007,メナン・ヤポ,"サンドラ・ブロック, シャアン・マクルーア"
マイ・フレンド・フォーエバー,ドラマ,4.3,1995,ピーター・ホートン,"ブラッド・レンフロ, ジョゼフ・マゼロ"
理由,スリラー,4.0,1995,アーネ・グリムシャー,"ショーン・コネリー, ローレンス・フィッシュバーン"
アメリカンヒストリーX,クライム,4,2,1998,トニー・ケイ,"エドワード・ノートン, エドワード・ファーロング"
運び屋,クライム,4.4,2018,クリント・イーストウッド,"クリント・イーストウッド, ブラッドリー・クーパー"
アメリカン・ビューティー,ロマンス,4.0,1999,サム・メンデス,"ミーナ・スヴァーリ, ケヴィン・スペイシー"
マニシスト,スリラー,4.2,2004,ブラッド・アンダーソン,"クリスチャン・ベール, ジェニファー・ジェイソン・リー"
ハッピーデスデイ,ホラー,4.0,2017,クリストファー・ランドン,"ジェシカ・ローテ, イズラエル・ブルサード"
ユージュアルサスペクツ,クライム,4.3,1995,ブライアン・シンガー,"ケヴィン・スペイシー, ベニチオ・デル・トロ"
マイ・レフトフット,ドラマ,3.8,1989,ジム・シェリダン,"ダニエル・デイルイス, ブレンダ・フリッカー"
キング・オブ・コメディ,クライム,4.3,1982,マーティン・スコセッシ,"ロバート・デニーロ, ジェリー・ルイス"
ハッピー・フライト,コメディ,3.8,2003,ブルーノ・バレット,"グウィネス・パルトロー, マーク・ラファロ"
フライト,スリラー,4.0,2012,ロバート・ゼメキス,"デンゼル・ワシントン, ケリー・ライリー"
ザ・コール,スリラー,4.2,2013,ブラッド・アンダーソン,"ハル・ベリー, アビゲイル・ブレスリン"
パルプ・フィクション,クライム,4.9,1994,クエンティン・タランティーノ,"ジョン・トラボルタ, ユマ・サーマン"
カジノ,クライム,4.0,1995,マーティン・スコセッシ,"ロバート・デニーロ, ジョー・ペシ"
アップグレード,アクション,3.9,2018,リー・ワネル,"ローガン・マーシャルグリーン, べティ・ガブリエル"
ウインド・リバー,スリラー,4.4,2017,テイラー・シェリダン,"ジェレミー・レナー, エリザベス・オルセン"
ブレイン・ゲーム,スリラー,4.3,2015,アフォンソ・ポイアルチ,"アンソニー・ホプキンス, コリン・ファレル"
ミリオンダラー・ベイビー,ドラマ,4.2,2004,クリント・イーストウッド,"ヒラリー・スワンク, モーガン・フリーマン"
眼科の敵,戦争,4.0,1957,ディック・パウエル,"クルト・ユルゲンス, ロバート・ミッチャム"
プリデスティネーション,SF,4.3,2014,マイケル・スピエリッグ,"サラ・スヌーク, イーサン・ホーク"
ハンナ,アクション,4.3,2011,ジョー・ライト,"シアーシャ・ローナン, ケイト・ブランシェット"
リンカーン弁護士,スリラー,4.1,2011,ブラッド・ファーマン,"マシュー・マコノヒー, ライアン・フィリップ"
アサイラム,ミステリー,4.4,2014,ブラッド・アンダーソン,"ベン・キングスレー, ケイト・ベッキンセイル"
幸せのちから,ドラマ,4.0,2006,ガブリエレ・ムッチーノ,"ウィル・スミス, ジェイデン・スミス"
アウトブレイク,スリラー,4.2,1995,ウォルフガング・ペーターゼン,"ダスティン・ホフマン, レネ・ルッソ"
ダイバージェント,SF,3.9,2014,ニール・バーガー,"シェイリーン・ウッドリー, テオ・ジェームズ"
キューブ,SF,3.9,1997,ヴィンチェンゾ・ナタリ,"ニッキー・グァダーニ, モーリス・ディーン・ウィント"
エベレスト3D,ドラマ,4.3,2015,バルタザール・コルマウクル,"ジェイク・ギレンホール, ジョシュ・ブローリン"
テネット,SF,4.0,2020,クリストファー・ノーラン,"エリザベス・デビッキ, ジョン・デヴィッド・ワシントン"
ボーン・コレクター,スリラー,4.1,1999,フィリップ・ノイス,"デンゼル・ワシントン, アンジェリーナ・ジョリー"
ディアボロス/悪魔の扉,ホラー,4.0,1997,テイラー・ハックフォード,"アル・パチーノ, キア・ヌリーブス"
永遠に僕のもの,クライム,4.0,2018,ルイス・オルテガ,"ロレンソ・フェロ, チノ・ダリン"
僕と世界の方程式,ドラマ,4.2,2014,モーガン・マシューズ,"エイサ・バターフィールド, サリー・ホーキンス"
1917命をかけた伝令,戦争,4.3,2019,サム・メンデス,"ジョージ・マッケイ, リチャード・マッデン"
ミッドサマー,ミステリー,3.9,2019,アリ・アスター,"フローレンス・ピュー, ウィル・ポールター"
ペット・セメタリー,ホラー,4.0,2019,ケビン・コルシュ,"ジェイソン・クラーク, エイミー・サイメッツ"
フォードvsフェラーリ,ドラマ,4.2,2019,ジェームズ・マンゴールド,"クリスチャン・ベール, マッド・デイモン"
ビューティー・インサイド,ロマンス,4.5,2015,パク・ジョンヨル,"ハン・ヒョジュ, パク・ソジュン"
ゴーン・ガール,スリラー,4.0,2014,デヴィッド・フィンチャー,"ロザムンド・パイク, ベン・アフレック"
マネー・ショート,ドラマ,4.1,2015,アダム・マッケイ,"スティーブン・セガール, クリスチャン・ベール"
ケープ・フィアー,クライム,4.3,1991,マーティン・スコセッシ,"ジュリエット・ルイス, ロバート・デニーロ"
女神の見えざる手,スリラー,4.0,2016,ジョン・マッデン,"ジェシカ・チャステイン, ググ・バサロー"
シャイニング,ホラー,4.5,1980.スタンリー・キューブリック,"ジャック・ニコルソン, シェリー・デュヴァル"
ドクタースリープ,ホラー,4.3,2019,マイク・フラナガン,"レベッカ・ファーガソン, ユアン・マクレガー"
IT,ホラー,4.3,2017,アンディ・ムスキエティ,"ビル・スカルスガルド, ジェイデン・マーテル"
IT-THE-END,ホラー,4.3,2019,アンディ・ムスキエティ,"ビル・ヘイダー, ジェシカ・チャステイン"


